<!ELEMENT bookstore (book+)> 
<!ELEMENT book (title, author, price, publishedYear)> 
<!ATTLIST book isbn CDATA #REQUIRED> 
<!ELEMENT title (#PCDATA)> 
<!ELEMENT author (#PCDATA)> 
<!ELEMENT price (#PCDATA)> 
<!ATTLIST price currency CDATA #REQUIRED> 
<!ELEMENT publishedYear (#PCDATA)>